{
  "ad_proximity_risk": "low",
  "alt_text": "Photo of hover-card",
  "anchor_index": 1,
  "anchor_selector": "h1:contains(\\\"hover-card\\\")",
  "anchor_text": "hover-card",
  "aspect_ratio": "16:9",
  "audience_hint": "general audience",
  "constraints": {},
  "discovered_at": "2026-01-10T18:43:01Z",
  "insertion_mode": "hero-container",
  "page_path": "src/components/ui/hover-card.tsx",
  "priority_level": "IMPORTANT",
  "prompt": "Photoreal hero image illustrating: Establish the topic: hover-card.",
  "purpose": "Establish the topic: hover-card",
  "realism_profile": "strict_photoreal",
  "recommended_size": "1600x900",
  "refined_at": "2026-01-10T18:59:43Z",
  "risk_factors": [
    "thin_content"
  ],
  "risk_score": 3.0,
  "slot_id": "ce2be1cb68dd",
  "slot_key": "hero-1",
  "source_context": "hover-card\" import { cn } from \"@/lib/utils\" function HoverCard({ ...props }: ComponentProps<typeof HoverCardPrimitive.Root>) { return <HoverCardPrimitive.Root data-slot=\"hover-card\" {...props} /> } function HoverCardTrigger({ ...props }: ComponentProps<typeof HoverCardPrimitive.Trigger>) { return ( <HoverCardPrimitive.Trigger data-slot=\"hover-card-trigger\" {...props} /> ) } function HoverCardContent({ className, align = \"center\", sideOffset = 4, ...props }: ComponentProps<typeof HoverCardPrimitive.Content>) { return ( <HoverCardPrimitive.Portal data-slot=\"hover-card-portal\"> <HoverCardPrimitive.Content data-slot=\"hover-card-content\" align={align} sideOffset={sideOffset} className={cn( \"bg-popover text-popover-",
  "status": "draft",
  "super_prompt": "Photoreal hero image illustrating: Establish the topic: hover-card. Scene details: hover-card\" import { cn } from \"@/lib/utils\" function HoverCard({ ...props }: ComponentProps<typeof HoverCardPrimitive.Root>) { return <HoverCardPrimitive.Root data-slot=\"hover-card\" {...props} /> } function HoverCardTrigger({ ...props }: ComponentProps<typeof HoverCardPrimitive.Trigger>) { return ( <HoverCardPrimitive.Trigger data-slot=\"hover-card-trigger\" {...props} /> ) } function HoverCardContent({ className, align = \"center\", sideOffset = 4, ...props }: ComponentProps<typeof HoverCardPrimitive.Content>) { return ( <HoverCardPrimitive.Portal data-slot=\"hover-card-portal\"> <HoverCardPrimitive.Content data-slot=\"hover-card-content\" align={align} sideOffset={sideOffset} className={cn( \"bg-popover text-popover- Camera: full-frame, 35mm lens, balanced composition, natural depth of field. Lighting: realistic, soft natural or practical lighting, no harsh artificial glow. Strict realism: natural textures, accurate proportions, realistic lighting, no CGI look, no surreal symmetry. Avoid: logos, watermarks, fake UI buttons, text overlays. Style: photoreal.",
  "technical_constraints": "Aspect ratio 16:9. Target size 1600x900.",
  "updated_at": "2026-01-11T16:42:57Z",
  "usage": "hero"
}