{
  "ad_proximity_risk": "low",
  "alt_text": "Photo of Categories",
  "anchor_index": 1,
  "anchor_selector": "h3:contains(\\\"Categories\\\")",
  "anchor_text": "Categories",
  "aspect_ratio": "16:9",
  "audience_hint": "general audience",
  "constraints": {
    "not_allowed": [
      "Alarm mounted on an oven door, stovetop, countertop, or cabinet.",
      "Alarm used as a handheld device or tool.",
      "Ad-like or button-like imagery."
    ],
    "reality_constraints": [
      "Smoke/CO alarms are ceiling- or wall-mounted only.",
      "Do not place alarms on ovens, stoves, countertops, or appliances.",
      "Alarms appear as real, round or square white plastic devices with a test button.",
      "If a kitchen is visible, the alarm is mounted on a ceiling or high wall."
    ]
  },
  "discovered_at": "2026-01-10T18:58:10Z",
  "insertion_mode": "after-heading",
  "page_path": "src/components/Footer.tsx",
  "priority_level": "IMPORTANT",
  "prompt": "Photoreal hero image illustrating: Establish the topic: Categories.",
  "purpose": "Establish the topic: Categories",
  "realism_profile": "strict_photoreal",
  "recommended_size": "1600x900",
  "refined_at": "2026-01-11T19:46:45Z",
  "risk_factors": [
    "thin_content"
  ],
  "risk_score": 3.0,
  "slot_id": "c9d06a3297b7",
  "slot_key": "hero-1",
  "source_context": "Educational resource for safety device troubleshooting. Not a substitute for professional inspection or emergency services.",
  "status": "draft",
  "super_prompt": "Photorealistic hero image representing the real-world meaning of the topic: Categories.\n\nFirst, interpret what this topic implies to a general audience in everyday life (e.g., confusion, problem-solving, reassurance, discovery, resolution). Then visually represent that meaning through a realistic moment or situation.\n\nThe scene must depict a believable, real-life scenario where the topic would naturally apply, not a staged setup or symbolic arrangement of objects.\n\nShow a single, specific moment in time that a human would immediately recognize as related to the topic, such as a pause during problem-solving, a moment of inspection or realization, a before-or-after state, or subtle signs that an issue is being addressed.\n\nAvoid generic desk setups, flat-lay compositions, or repeated object arrangements.\n\nPeople (if shown):\nRepresent typical United States demographics.\n70% male, 30% female distribution.\nShow diverse American backgrounds reflecting the US population.\n\nCamera:\nFull-frame camera, 35mm lens.\nNatural perspective, slight imperfections allowed.\nHuman eye-level or contextual angle (not overhead).\n\nLighting:\nNatural or practical indoor lighting.\nTime-of-day cues allowed.\nNo dramatic, cinematic, or studio lighting.\n\nStrict constraints:\n- No visible text.\n- No UI elements or readable screens.\n- No diagrams, icons, or symbols.\n- No branding, logos, or overlays.\n- No symmetry-heavy or stock-photo compositions.\n\nStyle:\nStrict photorealism.\nNo CGI, no illustration, no surreal elements.\n\nThe image should feel like a real photograph taken during an authentic moment related to the topic, clearly understandable without explanation.\n\nReality constraints (must be true):\n- Smoke/CO alarms are ceiling- or wall-mounted only.\n- Do not place alarms on ovens, stoves, countertops, or appliances.\n- Alarms appear as real, round or square white plastic devices with a test button.\n- If a kitchen is visible, the alarm is mounted on a ceiling or high wall.\n\nNot allowed:\n- Alarm mounted on an oven door, stovetop, countertop, or cabinet.\n- Alarm used as a handheld device or tool.\n- Ad-like or button-like imagery.\n\nDo not reuse visual compositions, object groupings, or scene layouts from previous images. Each image must feel like a different household and a different moment.",
  "technical_constraints": "Aspect ratio 16:9. Target size 1600x900.",
  "updated_at": "2026-01-11T19:46:31Z",
  "usage": "hero"
}