{
  "ad_proximity_risk": "low",
  "alt_text": "Photo of separator",
  "anchor_index": 1,
  "anchor_selector": "h1:contains(\\\"separator\\\")",
  "anchor_text": "separator",
  "aspect_ratio": "16:9",
  "audience_hint": "general audience",
  "constraints": {},
  "discovered_at": "2026-01-10T18:43:01Z",
  "insertion_mode": "hero-container",
  "page_path": "src/components/ui/separator.tsx",
  "priority_level": "IMPORTANT",
  "prompt": "Photoreal hero image illustrating: Establish the topic: separator.",
  "purpose": "Establish the topic: separator",
  "realism_profile": "strict_photoreal",
  "recommended_size": "1600x900",
  "refined_at": "2026-01-10T18:59:43Z",
  "risk_factors": [
    "thin_content"
  ],
  "risk_score": 3.0,
  "slot_id": "a0fdc3bf47d9",
  "slot_key": "hero-1",
  "source_context": "SeparatorPrimitive from \"@radix-ui/react-separator\" import { cn } from \"@/lib/utils\" function Separator({ className, orientation = \"horizontal\", decorative = true, ...props }: ComponentProps<typeof SeparatorPrimitive.Root>) { return ( <SeparatorPrimitive.Root data-slot=\"separator-root\" decorative={decorative} orientation={orientation} className={cn( \"bg-border shrink-0 data-[orientation=horizontal]:h-px data-[orientation=horizontal]:w-full data-[orientation=vertical]:h-full data-[orientation=vertical]:w-px\", className )} {...props} /> ) } export { Separator }",
  "status": "draft",
  "super_prompt": "Photoreal hero image illustrating: Establish the topic: separator. Scene details: SeparatorPrimitive from \"@radix-ui/react-separator\" import { cn } from \"@/lib/utils\" function Separator({ className, orientation = \"horizontal\", decorative = true, ...props }: ComponentProps<typeof SeparatorPrimitive.Root>) { return ( <SeparatorPrimitive.Root data-slot=\"separator-root\" decorative={decorative} orientation={orientation} className={cn( \"bg-border shrink-0 data-[orientation=horizontal]:h-px data-[orientation=horizontal]:w-full data-[orientation=vertical]:h-full data-[orientation=vertical]:w-px\", className )} {...props} /> ) } export { Separator } Camera: full-frame, 35mm lens, balanced composition, natural depth of field. Lighting: realistic, soft natural or practical lighting, no harsh artificial glow. Strict realism: natural textures, accurate proportions, realistic lighting, no CGI look, no surreal symmetry. Avoid: logos, watermarks, fake UI buttons, text overlays. Style: photoreal.",
  "technical_constraints": "Aspect ratio 16:9. Target size 1600x900.",
  "updated_at": "2026-01-11T16:42:57Z",
  "usage": "hero"
}