{
  "ad_proximity_risk": "low",
  "alt_text": "Photo of TopCommentsLeaderboard",
  "anchor_index": 1,
  "anchor_selector": "h1:contains(\\\"TopCommentsLeaderboard\\\")",
  "anchor_text": "TopCommentsLeaderboard",
  "aspect_ratio": "16:9",
  "audience_hint": "general audience",
  "constraints": {},
  "discovered_at": "2026-01-10T18:43:01Z",
  "insertion_mode": "hero-container",
  "page_path": "src/components/TopCommentsLeaderboard.tsx",
  "priority_level": "IMPORTANT",
  "prompt": "Photoreal hero image illustrating: Establish the topic: TopCommentsLeaderboard.",
  "purpose": "Establish the topic: TopCommentsLeaderboard",
  "realism_profile": "strict_photoreal",
  "recommended_size": "1600x900",
  "refined_at": "2026-01-10T18:59:43Z",
  "risk_factors": [],
  "risk_score": 0.0,
  "slot_id": "c3c6a605c99c",
  "slot_key": "hero-1",
  "source_context": "TopCommentsLeaderboard() { const [comments, setComments] = useKV<Comment[]>('top-comments', []) const [newComment, setNewComment] = useState('') const [authorName, setAuthorName] = useState('') const topThree = (comments || []) .sort((a, b) => b.votes - a.votes) .slice(0, 3) .map((comment, index): TopComment => ({ ...comment, rank: index + 1, badge: index === 0 ? 'gold' : index === 1 ? 'silver' : 'bronze' })) const handleSubmit = () => { if (newComment.trim().length === 0 || newComment.length > 200) { toast.error('Comment must be between 1 and 200 characters') return } if (authorName.trim().length === 0) { toast.error('Please enter your name') return } const comment: Comment = { id: Date.now()",
  "status": "draft",
  "super_prompt": "Photoreal hero image illustrating: Establish the topic: TopCommentsLeaderboard. Scene details: TopCommentsLeaderboard() { const [comments, setComments] = useKV<Comment[]>('top-comments', []) const [newComment, setNewComment] = useState('') const [authorName, setAuthorName] = useState('') const topThree = (comments || []) .sort((a, b) => b.votes - a.votes) .slice(0, 3) .map((comment, index): TopComment => ({ ...comment, rank: index + 1, badge: index === 0 ? 'gold' : index === 1 ? 'silver' : 'bronze' })) const handleSubmit = () => { if (newComment.trim().length === 0 || newComment.length > 200) { toast.error('Comment must be between 1 and 200 characters') return } if (authorName.trim().length === 0) { toast.error('Please enter your name') return } const comment: Comment = { id: Date.now() Camera: full-frame, 35mm lens, balanced composition, natural depth of field. Lighting: realistic, soft natural or practical lighting, no harsh artificial glow. Strict realism: natural textures, accurate proportions, realistic lighting, no CGI look, no surreal symmetry. Avoid: logos, watermarks, fake UI buttons, text overlays. Style: photoreal.",
  "technical_constraints": "Aspect ratio 16:9. Target size 1600x900.",
  "updated_at": "2026-01-11T16:42:57Z",
  "usage": "hero"
}