{
  "ad_proximity_risk": "low",
  "alt_text": "Photo of dialog",
  "anchor_index": 1,
  "anchor_selector": "h1:contains(\\\"dialog\\\")",
  "anchor_text": "dialog",
  "aspect_ratio": "16:9",
  "audience_hint": "general audience",
  "constraints": {},
  "discovered_at": "2026-01-10T18:43:01Z",
  "insertion_mode": "hero-container",
  "page_path": "src/components/ui/dialog.tsx",
  "priority_level": "IMPORTANT",
  "prompt": "Photoreal hero image illustrating: Establish the topic: dialog.",
  "purpose": "Establish the topic: dialog",
  "realism_profile": "strict_photoreal",
  "recommended_size": "1600x900",
  "refined_at": "2026-01-10T18:59:43Z",
  "risk_factors": [
    "light_content"
  ],
  "risk_score": 2.0,
  "slot_id": "57601ed7681e",
  "slot_key": "hero-1",
  "source_context": "DialogPrimitive from \"@radix-ui/react-dialog\" import XIcon from \"lucide-react/dist/esm/icons/x\" import { cn } from \"@/lib/utils\" function Dialog({ ...props }: ComponentProps<typeof DialogPrimitive.Root>) { return <DialogPrimitive.Root data-slot=\"dialog\" {...props} /> } function DialogTrigger({ ...props }: ComponentProps<typeof DialogPrimitive.Trigger>) { return <DialogPrimitive.Trigger data-slot=\"dialog-trigger\" {...props} /> } function DialogPortal({ ...props }: ComponentProps<typeof DialogPrimitive.Portal>) { return <DialogPrimitive.Portal data-slot=\"dialog-portal\" {...props} /> } function DialogClose({ ...props }: ComponentProps<typeof DialogPrimitive.Close>) { return <DialogPrimitive.Close data-slot=\"dialog-close\" {...props} /> } function DialogOverlay({ classNa",
  "status": "draft",
  "super_prompt": "Photoreal hero image illustrating: Establish the topic: dialog. Scene details: DialogPrimitive from \"@radix-ui/react-dialog\" import XIcon from \"lucide-react/dist/esm/icons/x\" import { cn } from \"@/lib/utils\" function Dialog({ ...props }: ComponentProps<typeof DialogPrimitive.Root>) { return <DialogPrimitive.Root data-slot=\"dialog\" {...props} /> } function DialogTrigger({ ...props }: ComponentProps<typeof DialogPrimitive.Trigger>) { return <DialogPrimitive.Trigger data-slot=\"dialog-trigger\" {...props} /> } function DialogPortal({ ...props }: ComponentProps<typeof DialogPrimitive.Portal>) { return <DialogPrimitive.Portal data-slot=\"dialog-portal\" {...props} /> } function DialogClose({ ...props }: ComponentProps<typeof DialogPrimitive.Close>) { return <DialogPrimitive.Close data-slot=\"dialog-close\" {...props} /> } function DialogOverlay({ classNa Camera: full-frame, 35mm lens, balanced composition, natural depth of field. Lighting: realistic, soft natural or practical lighting, no harsh artificial glow. Strict realism: natural textures, accurate proportions, realistic lighting, no CGI look, no surreal symmetry. Avoid: logos, watermarks, fake UI buttons, text overlays. Style: photoreal.",
  "technical_constraints": "Aspect ratio 16:9. Target size 1600x900.",
  "updated_at": "2026-01-11T16:42:57Z",
  "usage": "hero"
}