{
  "ad_proximity_risk": "low",
  "alt_text": "Photo of Troubleshooting Guides & Resources",
  "anchor_index": 1,
  "anchor_selector": "h2:contains(\\\"Troubleshooting Guides & Resources\\\")",
  "anchor_text": "Troubleshooting Guides & Resources",
  "aspect_ratio": "4:3",
  "audience_hint": "general audience",
  "constraints": {},
  "discovered_at": "2026-01-10T18:43:01Z",
  "insertion_mode": "after-heading",
  "page_path": "src/components/CategoryPage.tsx",
  "priority_level": "IMPORTANT",
  "prompt": "Photoreal inline image illustrating: Illustrate Troubleshooting Guides & Resources.",
  "purpose": "Illustrate Troubleshooting Guides & Resources",
  "realism_profile": "strict_photoreal",
  "recommended_size": "1200x900",
  "refined_at": "2026-01-10T18:59:43Z",
  "risk_factors": [],
  "risk_score": 0.0,
  "slot_id": "85b0994fb1d2",
  "slot_key": "inline-1",
  "source_context": "Troubleshooting Guides & Resources </h2> <p className=\"text-muted-foreground\"> Comprehensive step-by-step guides to solve {category.name.toLowerCase()} problems </p> </div> <div className=\"grid gap-6 md:grid-cols-2 lg:grid-cols-3\"> {categoryPosts.map((post) => ( <CategoryArticleCard key={post.id} post={post} /> ))} </div> </div> </section> <section className=\"border-b border-border bg-card\"> <div className=\"container mx-auto max-w-7xl px-4 py-12 md:py-16\"> <div className=\"mx-auto max-w-4xl\"> <h2 className=\"mb-8 text-center text-3xl font-semibold",
  "status": "draft",
  "super_prompt": "Photoreal inline image illustrating: Illustrate Troubleshooting Guides & Resources. Scene details: Troubleshooting Guides & Resources </h2> <p className=\"text-muted-foreground\"> Comprehensive step-by-step guides to solve {category.name.toLowerCase()} problems </p> </div> <div className=\"grid gap-6 md:grid-cols-2 lg:grid-cols-3\"> {categoryPosts.map((post) => ( <CategoryArticleCard key={post.id} post={post} /> ))} </div> </div> </section> <section className=\"border-b border-border bg-card\"> <div className=\"container mx-auto max-w-7xl px-4 py-12 md:py-16\"> <div className=\"mx-auto max-w-4xl\"> <h2 className=\"mb-8 text-center text-3xl font-semibold Camera: full-frame, 35mm lens, balanced composition, natural depth of field. Lighting: realistic, soft natural or practical lighting, no harsh artificial glow. Strict realism: natural textures, accurate proportions, realistic lighting, no CGI look, no surreal symmetry. Avoid: logos, watermarks, fake UI buttons, text overlays. Style: photoreal.",
  "technical_constraints": "Aspect ratio 4:3. Target size 1200x900.",
  "updated_at": "2026-01-11T16:42:57Z",
  "usage": "inline"
}