{
  "ad_proximity_risk": "low",
  "alt_text": "Photo of progress",
  "anchor_index": 1,
  "anchor_selector": "h1:contains(\\\"progress\\\")",
  "anchor_text": "progress",
  "aspect_ratio": "16:9",
  "audience_hint": "general audience",
  "constraints": {},
  "discovered_at": "2026-01-10T18:43:01Z",
  "insertion_mode": "hero-container",
  "page_path": "src/components/ui/progress.tsx",
  "priority_level": "IMPORTANT",
  "prompt": "Photoreal hero image illustrating: Establish the topic: progress.",
  "purpose": "Establish the topic: progress",
  "realism_profile": "strict_photoreal",
  "recommended_size": "1600x900",
  "refined_at": "2026-01-10T18:59:44Z",
  "risk_factors": [
    "thin_content"
  ],
  "risk_score": 3.0,
  "slot_id": "f8123403c10d",
  "slot_key": "hero-1",
  "source_context": "ProgressPrimitive from \"@radix-ui/react-progress\" import { cn } from \"@/lib/utils\" function Progress({ className, value, ...props }: ComponentProps<typeof ProgressPrimitive.Root>) { return ( <ProgressPrimitive.Root data-slot=\"progress\" className={cn( \"bg-primary/20 relative h-2 w-full overflow-hidden rounded-full\", className )} {...props} > <ProgressPrimitive.Indicator data-slot=\"progress-indicator\" className=\"bg-primary h-full w-full flex-1 transition-all\" style={{ transform: `translateX(-${100 - (value || 0)}%)` }} /> </ProgressPrimitive.Root> ) } export { Progress }",
  "status": "draft",
  "super_prompt": "Photoreal hero image illustrating: Establish the topic: progress. Scene details: ProgressPrimitive from \"@radix-ui/react-progress\" import { cn } from \"@/lib/utils\" function Progress({ className, value, ...props }: ComponentProps<typeof ProgressPrimitive.Root>) { return ( <ProgressPrimitive.Root data-slot=\"progress\" className={cn( \"bg-primary/20 relative h-2 w-full overflow-hidden rounded-full\", className )} {...props} > <ProgressPrimitive.Indicator data-slot=\"progress-indicator\" className=\"bg-primary h-full w-full flex-1 transition-all\" style={{ transform: `translateX(-${100 - (value || 0)}%)` }} /> </ProgressPrimitive.Root> ) } export { Progress } Camera: full-frame, 35mm lens, balanced composition, natural depth of field. Lighting: realistic, soft natural or practical lighting, no harsh artificial glow. Strict realism: natural textures, accurate proportions, realistic lighting, no CGI look, no surreal symmetry. Avoid: logos, watermarks, fake UI buttons, text overlays. Style: photoreal.",
  "technical_constraints": "Aspect ratio 16:9. Target size 1600x900.",
  "updated_at": "2026-01-11T16:42:57Z",
  "usage": "hero"
}