{
  "ad_proximity_risk": "med",
  "alt_text": "Photo of More from {category?.name || 'this category'}",
  "anchor_index": 1,
  "anchor_selector": "h2:contains(\\\"More from {category?.name || 'this category'}\\\")",
  "anchor_text": "More from {category?.name || 'this category'}",
  "aspect_ratio": "4:3",
  "audience_hint": "general audience",
  "constraints": {},
  "discovered_at": "2026-01-10T18:43:01Z",
  "insertion_mode": "after-heading",
  "page_path": "src/components/BlogPostPage.tsx",
  "priority_level": "IMPORTANT",
  "prompt": "Photoreal inline image illustrating: Illustrate More from {category?.name || 'this category'}.",
  "purpose": "Illustrate More from {category?.name || 'this category'}",
  "realism_profile": "strict_photoreal",
  "recommended_size": "1200x900",
  "refined_at": "2026-01-10T18:59:42Z",
  "risk_factors": [],
  "risk_score": 0.0,
  "slot_id": "1dcd7599b11b",
  "slot_key": "inline-2",
  "source_context": "More from {category?.name || 'this category'} </h2> <p className=\"mt-2 max-w-2xl text-muted-foreground\"> Related guides to help you troubleshoot safely and faster. </p> </div> </div> </div> <div className=\"grid gap-6 md:grid-cols-3\"> {posts.map((post, index) => { const featured = index === 0 return ( <Card key={post.id} className={[ 'flex flex-col card-hover', 'bg-background/60 border shadow-sm', featured ? 'md:col-span-2 card-featured' : '' ].join(' ')} > <div className=\"flex-1 p-6\"> <h3 className=\"",
  "status": "draft",
  "super_prompt": "Photoreal inline image illustrating: Illustrate More from {category?.name || 'this category'}. Scene details: More from {category?.name || 'this category'} </h2> <p className=\"mt-2 max-w-2xl text-muted-foreground\"> Related guides to help you troubleshoot safely and faster. </p> </div> </div> </div> <div className=\"grid gap-6 md:grid-cols-3\"> {posts.map((post, index) => { const featured = index === 0 return ( <Card key={post.id} className={[ 'flex flex-col card-hover', 'bg-background/60 border shadow-sm', featured ? 'md:col-span-2 card-featured' : '' ].join(' ')} > <div className=\"flex-1 p-6\"> <h3 className=\" Camera: full-frame, 35mm lens, balanced composition, natural depth of field. Lighting: realistic, soft natural or practical lighting, no harsh artificial glow. Strict realism: natural textures, accurate proportions, realistic lighting, no CGI look, no surreal symmetry. Avoid: logos, watermarks, fake UI buttons, text overlays. Style: photoreal.",
  "technical_constraints": "Aspect ratio 4:3. Target size 1200x900.",
  "updated_at": "2026-01-11T16:42:57Z",
  "usage": "inline"
}