{
  "ad_proximity_risk": "med",
  "alt_text": "Photo of JSON-LD Structured Data Schema \u2705 COMPLETE",
  "anchor_index": 1,
  "anchor_selector": "h3:contains(\\\"JSON-LD Structured Data Schema \u2705 COMPLETE\\\")",
  "anchor_text": "JSON-LD Structured Data Schema \u2705 COMPLETE",
  "aspect_ratio": "4:3",
  "audience_hint": "general audience",
  "constraints": {},
  "discovered_at": "2026-01-10T18:43:01Z",
  "insertion_mode": "after-heading",
  "page_path": "TECHNICAL_SEO_SECURITY_ACCESSIBILITY.md",
  "priority_level": "IMPORTANT",
  "prompt": "Photoreal inline image illustrating: Illustrate JSON-LD Structured Data Schema \u2705 COMPLETE.",
  "purpose": "Illustrate JSON-LD Structured Data Schema \u2705 COMPLETE",
  "realism_profile": "strict_photoreal",
  "recommended_size": "1200x900",
  "refined_at": "2026-01-10T18:59:43Z",
  "risk_factors": [],
  "risk_score": 0.0,
  "slot_id": "35c9a83f3f36",
  "slot_key": "inline-4",
  "source_context": "JSON-LD Structured Data Schema \u2705 COMPLETE **Implementation Location:** `src/lib/seo.ts` + `src/App.tsx` **Schema Types Implemented:** #### 1. Organization Schema ```json { \"@context\": \"https://schema.org\", \"@type\": \"Organization\", \"name\": \"AlarmBeepGuide\", \"url\": \"https://alarmbeepguide.com\", \"logo\": \"https://alarmbeepguide.com/logo.png\", \"description\": \"Educational resource for household alarm systems...\", \"sameAs\": [] } ``` **Purpose:** Establishes brand entity for Google Knowledge Graph --- #### 2. WebSite Schema with SearchAction ```json { \"@context\": \"https://schema.org\", \"@type\": \"WebSite\", \"name\": \"AlarmBeepGuide\", \"url\": \"https://alarmbeepguide.com\", \"potentialAction\": { \"@type\": \"SearchAction\", \"target\": \"https://alarmbeepguide.com/search?q={se",
  "status": "draft",
  "super_prompt": "Photoreal inline image illustrating: Illustrate JSON-LD Structured Data Schema \u2705 COMPLETE. Scene details: JSON-LD Structured Data Schema \u2705 COMPLETE **Implementation Location:** `src/lib/seo.ts` + `src/App.tsx` **Schema Types Implemented:** #### 1. Organization Schema ```json { \"@context\": \"https://schema.org\", \"@type\": \"Organization\", \"name\": \"AlarmBeepGuide\", \"url\": \"https://alarmbeepguide.com\", \"logo\": \"https://alarmbeepguide.com/logo.png\", \"description\": \"Educational resource for household alarm systems...\", \"sameAs\": [] } ``` **Purpose:** Establishes brand entity for Google Knowledge Graph --- #### 2. WebSite Schema with SearchAction ```json { \"@context\": \"https://schema.org\", \"@type\": \"WebSite\", \"name\": \"AlarmBeepGuide\", \"url\": \"https://alarmbeepguide.com\", \"potentialAction\": { \"@type\": \"SearchAction\", \"target\": \"https://alarmbeepguide.com/search?q={se Camera: full-frame, 35mm lens, balanced composition, natural depth of field. Lighting: realistic, soft natural or practical lighting, no harsh artificial glow. Strict realism: natural textures, accurate proportions, realistic lighting, no CGI look, no surreal symmetry. Avoid: logos, watermarks, fake UI buttons, text overlays. Style: photoreal.",
  "technical_constraints": "Aspect ratio 4:3. Target size 1200x900.",
  "updated_at": "2026-01-11T16:42:57Z",
  "usage": "inline"
}