{
  "ad_proximity_risk": "low",
  "alt_text": "Photo of Understand What It Means",
  "anchor_index": 1,
  "anchor_selector": "h3:contains(\\\"Understand What It Means\\\")",
  "anchor_text": "Understand What It Means",
  "aspect_ratio": "4:3",
  "audience_hint": "general audience",
  "constraints": {},
  "discovered_at": "2026-01-10T18:43:01Z",
  "insertion_mode": "after-heading",
  "page_path": "src/components/HomePage.tsx",
  "priority_level": "IMPORTANT",
  "prompt": "Photoreal inline image illustrating: Illustrate Understand What It Means.",
  "purpose": "Illustrate Understand What It Means",
  "realism_profile": "strict_photoreal",
  "recommended_size": "1200x900",
  "refined_at": "2026-01-10T18:59:43Z",
  "risk_factors": [],
  "risk_score": 0.0,
  "slot_id": "c727d47ba244",
  "slot_key": "inline-4",
  "source_context": "Understand What It Means</h3> <p className=\"text-sm leading-relaxed text-muted-foreground\"> Get plain-English explanations\u2014no technical jargon, just clear answers about what's happening. </p> </Card> <Card className=\"card-hover relative p-7 text-center bg-card border border-border/70 shadow-md md:translate-y-1\"> <div className=\"mb-4 flex justify-center\"> <div className=\"flex h-12 w-12 items-center justify-center rounded-2xl bg-primary text-primary-foreground text-2xl font-extrabold shadow-md\"> 3 </div> </div> <h3 className=\"mb-2 text-xl font-semibold tracking-tight\">Fix It Safely</h3> <p className=\"text-sm leading-rel",
  "status": "draft",
  "super_prompt": "Photoreal inline image illustrating: Illustrate Understand What It Means. Scene details: Understand What It Means</h3> <p className=\"text-sm leading-relaxed text-muted-foreground\"> Get plain-English explanations\u2014no technical jargon, just clear answers about what's happening. </p> </Card> <Card className=\"card-hover relative p-7 text-center bg-card border border-border/70 shadow-md md:translate-y-1\"> <div className=\"mb-4 flex justify-center\"> <div className=\"flex h-12 w-12 items-center justify-center rounded-2xl bg-primary text-primary-foreground text-2xl font-extrabold shadow-md\"> 3 </div> </div> <h3 className=\"mb-2 text-xl font-semibold tracking-tight\">Fix It Safely</h3> <p className=\"text-sm leading-rel Camera: full-frame, 35mm lens, balanced composition, natural depth of field. Lighting: realistic, soft natural or practical lighting, no harsh artificial glow. Strict realism: natural textures, accurate proportions, realistic lighting, no CGI look, no surreal symmetry. Avoid: logos, watermarks, fake UI buttons, text overlays. Style: photoreal.",
  "technical_constraints": "Aspect ratio 4:3. Target size 1200x900.",
  "updated_at": "2026-01-11T16:42:57Z",
  "usage": "inline"
}