{
  "ad_proximity_risk": "low",
  "alt_text": "Photo of CategoryCards",
  "anchor_index": 1,
  "anchor_selector": "h1:contains(\\\"CategoryCards\\\")",
  "anchor_text": "CategoryCards",
  "aspect_ratio": "16:9",
  "audience_hint": "general audience",
  "constraints": {},
  "discovered_at": "2026-01-10T18:43:01Z",
  "insertion_mode": "hero-container",
  "page_path": "src/components/CategoryCards.tsx",
  "priority_level": "IMPORTANT",
  "prompt": "Photoreal hero image illustrating: Establish the topic: CategoryCards.",
  "purpose": "Establish the topic: CategoryCards",
  "realism_profile": "strict_photoreal",
  "recommended_size": "1600x900",
  "refined_at": "2026-01-10T18:59:42Z",
  "risk_factors": [
    "light_content"
  ],
  "risk_score": 2.0,
  "slot_id": "03edda722e36",
  "slot_key": "hero-1",
  "source_context": "CategoryCards() { const blogCategories = getBlogCategories() const getCategoryArticleCount = (categoryId: string): number => { return blogCategories.find(bc => bc.category === categoryId)?.count || 0 } return ( <div className=\"grid gap-6 sm:grid-cols-2 lg:grid-cols-3\"> {categories.map((category, index) => { const articleCount = getCategoryArticleCount(category.id) const isFeatured = index === 0 const staggerClass = index === 1 ? 'lg:-translate-y-1' : index === 2 ? 'lg:translate-y-1' : '' const featuredClass = isFeatured ?",
  "status": "draft",
  "super_prompt": "Photoreal hero image illustrating: Establish the topic: CategoryCards. Scene details: CategoryCards() { const blogCategories = getBlogCategories() const getCategoryArticleCount = (categoryId: string): number => { return blogCategories.find(bc => bc.category === categoryId)?.count || 0 } return ( <div className=\"grid gap-6 sm:grid-cols-2 lg:grid-cols-3\"> {categories.map((category, index) => { const articleCount = getCategoryArticleCount(category.id) const isFeatured = index === 0 const staggerClass = index === 1 ? 'lg:-translate-y-1' : index === 2 ? 'lg:translate-y-1' : '' const featuredClass = isFeatured ? Camera: full-frame, 35mm lens, balanced composition, natural depth of field. Lighting: realistic, soft natural or practical lighting, no harsh artificial glow. Strict realism: natural textures, accurate proportions, realistic lighting, no CGI look, no surreal symmetry. Avoid: logos, watermarks, fake UI buttons, text overlays. Style: photoreal.",
  "technical_constraints": "Aspect ratio 16:9. Target size 1600x900.",
  "updated_at": "2026-01-11T16:42:57Z",
  "usage": "hero"
}