{
  "ad_proximity_risk": "low",
  "alt_text": "Photo of Footer",
  "anchor_index": 1,
  "anchor_selector": "h1:contains(\\\"Footer\\\")",
  "anchor_text": "Footer",
  "aspect_ratio": "16:9",
  "audience_hint": "general audience",
  "constraints": {},
  "discovered_at": "2026-01-10T18:43:01Z",
  "insertion_mode": "hero-container",
  "page_path": "src/components/Footer.tsx",
  "priority_level": "IMPORTANT",
  "prompt": "Photoreal hero image illustrating: Establish the topic: Footer.",
  "purpose": "Establish the topic: Footer",
  "realism_profile": "strict_photoreal",
  "recommended_size": "1600x900",
  "refined_at": "2026-01-10T18:59:43Z",
  "risk_factors": [
    "light_content"
  ],
  "risk_score": 2.0,
  "slot_id": "e1b23f73330c",
  "slot_key": "hero-1",
  "source_context": "Footer() { return ( <footer className=\"border-t border-border bg-card\"> <div className=\"container mx-auto max-w-7xl px-4 py-12\"> <div className=\"grid gap-8 md:grid-cols-4\"> <div> <div className=\"mb-4 flex items-center space-x-2\"> <div className=\"flex h-8 w-8 items-center justify-center rounded-lg bg-primary text-primary-foreground\"> <span className=\"text-sm font-bold\">AB</span> </div> <span className=\"font-bold text-foreground\">AlarmBeepGuide</span> </div> <p className=\"text-sm text-muted-foreground\"> Decode alarm beeps and troubleshoot safety devices without manuals. Plain-English solutions for homeowners. </p> </div> <d",
  "status": "draft",
  "super_prompt": "Photoreal hero image illustrating: Establish the topic: Footer. Scene details: Footer() { return ( <footer className=\"border-t border-border bg-card\"> <div className=\"container mx-auto max-w-7xl px-4 py-12\"> <div className=\"grid gap-8 md:grid-cols-4\"> <div> <div className=\"mb-4 flex items-center space-x-2\"> <div className=\"flex h-8 w-8 items-center justify-center rounded-lg bg-primary text-primary-foreground\"> <span className=\"text-sm font-bold\">AB</span> </div> <span className=\"font-bold text-foreground\">AlarmBeepGuide</span> </div> <p className=\"text-sm text-muted-foreground\"> Decode alarm beeps and troubleshoot safety devices without manuals. Plain-English solutions for homeowners. </p> </div> <d Camera: full-frame, 35mm lens, balanced composition, natural depth of field. Lighting: realistic, soft natural or practical lighting, no harsh artificial glow. Strict realism: natural textures, accurate proportions, realistic lighting, no CGI look, no surreal symmetry. Avoid: logos, watermarks, fake UI buttons, text overlays. Style: photoreal.",
  "technical_constraints": "Aspect ratio 16:9. Target size 1600x900.",
  "updated_at": "2026-01-11T16:42:57Z",
  "usage": "hero"
}