{
  "ad_proximity_risk": "low",
  "alt_text": "Photo of Visitor Engagement & Retention Strategy",
  "anchor_index": 1,
  "anchor_selector": "h1:contains(\\\"Visitor Engagement & Retention Strategy\\\")",
  "anchor_text": "Visitor Engagement & Retention Strategy",
  "aspect_ratio": "16:9",
  "audience_hint": "general audience",
  "constraints": {},
  "discovered_at": "2026-01-10T18:43:01Z",
  "insertion_mode": "hero-container",
  "page_path": "VISITOR_ENGAGEMENT_RETENTION_STRATEGY.md",
  "priority_level": "IMPORTANT",
  "prompt": "Photoreal hero image illustrating: Establish the topic: Visitor Engagement & Retention Strategy.",
  "purpose": "Establish the topic: Visitor Engagement & Retention Strategy",
  "realism_profile": "strict_photoreal",
  "recommended_size": "1600x900",
  "refined_at": "2026-01-10T18:59:43Z",
  "risk_factors": [],
  "risk_score": 0.0,
  "slot_id": "58ee6e21e804",
  "slot_key": "hero-1",
  "source_context": "Visitor Engagement & Retention Strategy ## AlarmBeepGuide.com \u2014 Session Depth Optimization for AdSense Revenue **Last Updated:** January 2024 **Purpose:** Maximize session time, pageviews per visit, and repeat visits to optimize Google AdSense RPM **Status:** Foundation Implemented \u2014 Enhancement Blueprint Ready --- ## \ud83c\udfaf STRATEGIC OBJECTIVES ### Primary Goals 1. **Increase Session Duration:** 3+ minutes average (currently strong with blog content) 2. **Increase Pages Per Session:** 2.5+ pages average (cross-article navigation) 3.",
  "status": "draft",
  "super_prompt": "Photoreal hero image illustrating: Establish the topic: Visitor Engagement & Retention Strategy. Scene details: Visitor Engagement & Retention Strategy ## AlarmBeepGuide.com \u2014 Session Depth Optimization for AdSense Revenue **Last Updated:** January 2024 **Purpose:** Maximize session time, pageviews per visit, and repeat visits to optimize Google AdSense RPM **Status:** Foundation Implemented \u2014 Enhancement Blueprint Ready --- ## \ud83c\udfaf STRATEGIC OBJECTIVES ### Primary Goals 1. **Increase Session Duration:** 3+ minutes average (currently strong with blog content) 2. **Increase Pages Per Session:** 2.5+ pages average (cross-article navigation) 3. Camera: full-frame, 35mm lens, balanced composition, natural depth of field. Lighting: realistic, soft natural or practical lighting, no harsh artificial glow. Strict realism: natural textures, accurate proportions, realistic lighting, no CGI look, no surreal symmetry. Avoid: logos, watermarks, fake UI buttons, text overlays. Style: photoreal.",
  "technical_constraints": "Aspect ratio 16:9. Target size 1600x900.",
  "updated_at": "2026-01-11T16:42:57Z",
  "usage": "hero"
}