{
  "ad_proximity_risk": "low",
  "alt_text": "Photo of switch",
  "anchor_index": 1,
  "anchor_selector": "h1:contains(\\\"switch\\\")",
  "anchor_text": "switch",
  "aspect_ratio": "16:9",
  "audience_hint": "general audience",
  "constraints": {},
  "discovered_at": "2026-01-10T18:43:01Z",
  "insertion_mode": "hero-container",
  "page_path": "src/components/ui/switch.tsx",
  "priority_level": "IMPORTANT",
  "prompt": "Photoreal hero image illustrating: Establish the topic: switch.",
  "purpose": "Establish the topic: switch",
  "realism_profile": "strict_photoreal",
  "recommended_size": "1600x900",
  "refined_at": "2026-01-10T18:59:43Z",
  "risk_factors": [
    "thin_content"
  ],
  "risk_score": 3.0,
  "slot_id": "dfc654fe7db6",
  "slot_key": "hero-1",
  "source_context": "SwitchPrimitive from \"@radix-ui/react-switch\" import { cn } from \"@/lib/utils\" function Switch({ className, ...props }: ComponentProps<typeof SwitchPrimitive.Root>) { return ( <SwitchPrimitive.Root data-slot=\"switch\" className={cn( \"peer data-[state=checked]:bg-primary data-[state=unchecked]:bg-input focus-visible:border-ring focus-visible:ring-ring/50 dark:data-[state=unchecked]:bg-input/80 inline-flex h-[1.15rem] w-8 shrink-0 items-center rounded-full border border-transparent shadow-xs transition-all outline-none focus-visible:ring-[3px] disabled:cursor-not-allowed disabled:opacity-50\", className )} {...props} > <SwitchPrimitive.Thumb data-slot=\"switch-thumb\" className={cn( \"bg-background dark:data-[",
  "status": "draft",
  "super_prompt": "Photoreal hero image illustrating: Establish the topic: switch. Scene details: SwitchPrimitive from \"@radix-ui/react-switch\" import { cn } from \"@/lib/utils\" function Switch({ className, ...props }: ComponentProps<typeof SwitchPrimitive.Root>) { return ( <SwitchPrimitive.Root data-slot=\"switch\" className={cn( \"peer data-[state=checked]:bg-primary data-[state=unchecked]:bg-input focus-visible:border-ring focus-visible:ring-ring/50 dark:data-[state=unchecked]:bg-input/80 inline-flex h-[1.15rem] w-8 shrink-0 items-center rounded-full border border-transparent shadow-xs transition-all outline-none focus-visible:ring-[3px] disabled:cursor-not-allowed disabled:opacity-50\", className )} {...props} > <SwitchPrimitive.Thumb data-slot=\"switch-thumb\" className={cn( \"bg-background dark:data-[ Camera: full-frame, 35mm lens, balanced composition, natural depth of field. Lighting: realistic, soft natural or practical lighting, no harsh artificial glow. Strict realism: natural textures, accurate proportions, realistic lighting, no CGI look, no surreal symmetry. Avoid: logos, watermarks, fake UI buttons, text overlays. Style: photoreal.",
  "technical_constraints": "Aspect ratio 16:9. Target size 1600x900.",
  "updated_at": "2026-01-11T16:42:57Z",
  "usage": "hero"
}