{
  "ad_proximity_risk": "low",
  "alt_text": "Photo of slider",
  "anchor_index": 1,
  "anchor_selector": "h1:contains(\\\"slider\\\")",
  "anchor_text": "slider",
  "aspect_ratio": "16:9",
  "audience_hint": "general audience",
  "constraints": {},
  "discovered_at": "2026-01-10T18:43:01Z",
  "insertion_mode": "hero-container",
  "page_path": "src/components/ui/slider.tsx",
  "priority_level": "IMPORTANT",
  "prompt": "Photoreal hero image illustrating: Establish the topic: slider.",
  "purpose": "Establish the topic: slider",
  "realism_profile": "strict_photoreal",
  "recommended_size": "1600x900",
  "refined_at": "2026-01-10T18:59:43Z",
  "risk_factors": [
    "thin_content"
  ],
  "risk_score": 3.0,
  "slot_id": "b67fed72f73b",
  "slot_key": "hero-1",
  "source_context": "SliderPrimitive from \"@radix-ui/react-slider\" import { cn } from \"@/lib/utils\" function Slider({ className, defaultValue, value, min = 0, max = 100, ...props }: ComponentProps<typeof SliderPrimitive.Root>) { const _values = useMemo( () => Array.isArray(value) ? value : Array.isArray(defaultValue) ? defaultValue : [min, max], [value, defaultValue, min, max] ) return ( <SliderPrimitive.Root data-slot=\"slider\" defaultValue={defaultValue} value={value} min={min} max={max} className={cn( \"relative flex w-full touch-none items-center select-none data-[disabled]:opacity-50 data-[orientation=vertical]:h-full data-[orientation=vertical]:min-h-44 data-[orientation=vertical]:w-auto d",
  "status": "draft",
  "super_prompt": "Photoreal hero image illustrating: Establish the topic: slider. Scene details: SliderPrimitive from \"@radix-ui/react-slider\" import { cn } from \"@/lib/utils\" function Slider({ className, defaultValue, value, min = 0, max = 100, ...props }: ComponentProps<typeof SliderPrimitive.Root>) { const _values = useMemo( () => Array.isArray(value) ? value : Array.isArray(defaultValue) ? defaultValue : [min, max], [value, defaultValue, min, max] ) return ( <SliderPrimitive.Root data-slot=\"slider\" defaultValue={defaultValue} value={value} min={min} max={max} className={cn( \"relative flex w-full touch-none items-center select-none data-[disabled]:opacity-50 data-[orientation=vertical]:h-full data-[orientation=vertical]:min-h-44 data-[orientation=vertical]:w-auto d Camera: full-frame, 35mm lens, balanced composition, natural depth of field. Lighting: realistic, soft natural or practical lighting, no harsh artificial glow. Strict realism: natural textures, accurate proportions, realistic lighting, no CGI look, no surreal symmetry. Avoid: logos, watermarks, fake UI buttons, text overlays. Style: photoreal.",
  "technical_constraints": "Aspect ratio 16:9. Target size 1600x900.",
  "updated_at": "2026-01-11T16:42:57Z",
  "usage": "hero"
}