{
  "ad_proximity_risk": "low",
  "alt_text": "Photo of Your 3-Step Alert Resolution Path",
  "anchor_index": 1,
  "anchor_selector": "h2:contains(\\\"Your 3-Step Alert Resolution Path\\\")",
  "anchor_text": "Your 3-Step Alert Resolution Path",
  "aspect_ratio": "4:3",
  "audience_hint": "general audience",
  "constraints": {},
  "discovered_at": "2026-01-10T18:43:01Z",
  "insertion_mode": "after-heading",
  "page_path": "src/components/HomePage.tsx",
  "priority_level": "IMPORTANT",
  "prompt": "Photoreal inline image illustrating: Illustrate Your 3-Step Alert Resolution Path.",
  "purpose": "Illustrate Your 3-Step Alert Resolution Path",
  "realism_profile": "strict_photoreal",
  "recommended_size": "1200x900",
  "refined_at": "2026-01-10T18:59:43Z",
  "risk_factors": [],
  "risk_score": 0.0,
  "slot_id": "265b65a0a5f5",
  "slot_key": "inline-2",
  "source_context": "Your 3-Step Alert Resolution Path </h2> <p className=\"mx-auto max-w-2xl text-muted-foreground\"> We turn beep patterns into safe, plain-English actions so you can move fast with confidence. </p> </div> </div> </div> <div className=\"grid gap-6 md:grid-cols-3\"> <Card className=\"card-hover relative p-7 text-center bg-card border border-border/70 shadow-md\"> <div className=\"mb-4 flex justify-center\"> <div className=\"flex h-12 w-12 items-center justify-center rounded-2xl bg-primary text-primary-foreground text-2xl font-extrabold shadow-md\"> 1 </div> </div> <h3 className=\"mb-2 text-x",
  "status": "draft",
  "super_prompt": "Photoreal inline image illustrating: Illustrate Your 3-Step Alert Resolution Path. Scene details: Your 3-Step Alert Resolution Path </h2> <p className=\"mx-auto max-w-2xl text-muted-foreground\"> We turn beep patterns into safe, plain-English actions so you can move fast with confidence. </p> </div> </div> </div> <div className=\"grid gap-6 md:grid-cols-3\"> <Card className=\"card-hover relative p-7 text-center bg-card border border-border/70 shadow-md\"> <div className=\"mb-4 flex justify-center\"> <div className=\"flex h-12 w-12 items-center justify-center rounded-2xl bg-primary text-primary-foreground text-2xl font-extrabold shadow-md\"> 1 </div> </div> <h3 className=\"mb-2 text-x Camera: full-frame, 35mm lens, balanced composition, natural depth of field. Lighting: realistic, soft natural or practical lighting, no harsh artificial glow. Strict realism: natural textures, accurate proportions, realistic lighting, no CGI look, no surreal symmetry. Avoid: logos, watermarks, fake UI buttons, text overlays. Style: photoreal.",
  "technical_constraints": "Aspect ratio 4:3. Target size 1200x900.",
  "updated_at": "2026-01-11T16:42:57Z",
  "usage": "inline"
}