{
  "ad_proximity_risk": "med",
  "alt_text": "Photo of More {category.name} Resources",
  "anchor_index": 1,
  "anchor_selector": "h3:contains(\\\"More {category.name} Resources\\\")",
  "anchor_text": "More {category.name} Resources",
  "aspect_ratio": "4:3",
  "audience_hint": "general audience",
  "constraints": {},
  "discovered_at": "2026-01-10T18:43:01Z",
  "insertion_mode": "after-heading",
  "page_path": "src/components/BlogPostPage.tsx",
  "priority_level": "IMPORTANT",
  "prompt": "Photoreal inline image illustrating: Illustrate More {category.name} Resources.",
  "purpose": "Illustrate More {category.name} Resources",
  "realism_profile": "strict_photoreal",
  "recommended_size": "1200x900",
  "refined_at": "2026-01-10T18:59:43Z",
  "risk_factors": [],
  "risk_score": 0.0,
  "slot_id": "26e538e8b684",
  "slot_key": "inline-3",
  "source_context": "More {category.name} Resources </h3> <p className=\"mb-6 text-muted-foreground\"> {category.description} </p> <div className=\"flex flex-col gap-3 sm:flex-row sm:justify-center\"> <Button asChild> <Link href={`/${category.slug}`}> Browse All {category.name} Guides <CaretRight className=\"ml-2 h-4 w-4\" /> </Link> </Button> <Button variant=\"outline\" asChild> <Link href=\"/blog\"> View All Articles </Link> </Button> </div> </div> </Card> </div> </section> ) }",
  "status": "draft",
  "super_prompt": "Photoreal inline image illustrating: Illustrate More {category.name} Resources. Scene details: More {category.name} Resources </h3> <p className=\"mb-6 text-muted-foreground\"> {category.description} </p> <div className=\"flex flex-col gap-3 sm:flex-row sm:justify-center\"> <Button asChild> <Link href={`/${category.slug}`}> Browse All {category.name} Guides <CaretRight className=\"ml-2 h-4 w-4\" /> </Link> </Button> <Button variant=\"outline\" asChild> <Link href=\"/blog\"> View All Articles </Link> </Button> </div> </div> </Card> </div> </section> ) } Camera: full-frame, 35mm lens, balanced composition, natural depth of field. Lighting: realistic, soft natural or practical lighting, no harsh artificial glow. Strict realism: natural textures, accurate proportions, realistic lighting, no CGI look, no surreal symmetry. Avoid: logos, watermarks, fake UI buttons, text overlays. Style: photoreal.",
  "technical_constraints": "Aspect ratio 4:3. Target size 1200x900.",
  "updated_at": "2026-01-11T16:42:57Z",
  "usage": "inline"
}