{
  "ad_proximity_risk": "low",
  "alt_text": "Photo of scroll-area",
  "anchor_index": 1,
  "anchor_selector": "h1:contains(\\\"scroll-area\\\")",
  "anchor_text": "scroll-area",
  "aspect_ratio": "16:9",
  "audience_hint": "general audience",
  "constraints": {},
  "discovered_at": "2026-01-10T18:43:01Z",
  "insertion_mode": "hero-container",
  "page_path": "src/components/ui/scroll-area.tsx",
  "priority_level": "IMPORTANT",
  "prompt": "Photoreal hero image illustrating: Establish the topic: scroll-area.",
  "purpose": "Establish the topic: scroll-area",
  "realism_profile": "strict_photoreal",
  "recommended_size": "1600x900",
  "refined_at": "2026-01-10T18:59:43Z",
  "risk_factors": [
    "thin_content"
  ],
  "risk_score": 3.0,
  "slot_id": "c2289ded8f0c",
  "slot_key": "hero-1",
  "source_context": "scroll-area\" import { cn } from \"@/lib/utils\" function ScrollArea({ className, children, ...props }: ComponentProps<typeof ScrollAreaPrimitive.Root>) { return ( <ScrollAreaPrimitive.Root data-slot=\"scroll-area\" className={cn(\"relative\", className)} {...props} > <ScrollAreaPrimitive.Viewport data-slot=\"scroll-area-viewport\" className=\"focus-visible:ring-ring/50 size-full rounded-[inherit] transition-[color,box-shadow] outline-none focus-visible:ring-[3px] focus-visible:outline-1\" > {children} </ScrollAreaPrimitive.Viewport> <ScrollBar /> <ScrollAreaPrimitive.Corner /> </ScrollAreaPrimitive.Root> ) } function ScrollBar({ className, orientation = \"vertical\", ...props }: ComponentProps<typeof",
  "status": "draft",
  "super_prompt": "Photoreal hero image illustrating: Establish the topic: scroll-area. Scene details: scroll-area\" import { cn } from \"@/lib/utils\" function ScrollArea({ className, children, ...props }: ComponentProps<typeof ScrollAreaPrimitive.Root>) { return ( <ScrollAreaPrimitive.Root data-slot=\"scroll-area\" className={cn(\"relative\", className)} {...props} > <ScrollAreaPrimitive.Viewport data-slot=\"scroll-area-viewport\" className=\"focus-visible:ring-ring/50 size-full rounded-[inherit] transition-[color,box-shadow] outline-none focus-visible:ring-[3px] focus-visible:outline-1\" > {children} </ScrollAreaPrimitive.Viewport> <ScrollBar /> <ScrollAreaPrimitive.Corner /> </ScrollAreaPrimitive.Root> ) } function ScrollBar({ className, orientation = \"vertical\", ...props }: ComponentProps<typeof Camera: full-frame, 35mm lens, balanced composition, natural depth of field. Lighting: realistic, soft natural or practical lighting, no harsh artificial glow. Strict realism: natural textures, accurate proportions, realistic lighting, no CGI look, no surreal symmetry. Avoid: logos, watermarks, fake UI buttons, text overlays. Style: photoreal.",
  "technical_constraints": "Aspect ratio 16:9. Target size 1600x900.",
  "updated_at": "2026-01-11T16:42:57Z",
  "usage": "hero"
}