{
  "ad_proximity_risk": "low",
  "alt_text": "Photo of context-menu",
  "anchor_index": 1,
  "anchor_selector": "h1:contains(\\\"context-menu\\\")",
  "anchor_text": "context-menu",
  "aspect_ratio": "16:9",
  "audience_hint": "general audience",
  "constraints": {},
  "discovered_at": "2026-01-10T18:43:01Z",
  "insertion_mode": "hero-container",
  "page_path": "src/components/ui/context-menu.tsx",
  "priority_level": "IMPORTANT",
  "prompt": "Photoreal hero image illustrating: Establish the topic: context-menu.",
  "purpose": "Establish the topic: context-menu",
  "realism_profile": "strict_photoreal",
  "recommended_size": "1600x900",
  "refined_at": "2026-01-10T18:59:43Z",
  "risk_factors": [],
  "risk_score": 0.0,
  "slot_id": "7515e0d37989",
  "slot_key": "hero-1",
  "source_context": "context-menu\" import CheckIcon from \"lucide-react/dist/esm/icons/check\"; import ChevronRightIcon from \"lucide-react/dist/esm/icons/chevron-right\" import CircleIcon from \"lucide-react/dist/esm/icons/circle\" import { cn } from \"@/lib/utils\" function ContextMenu({ ...props }: ComponentProps<typeof ContextMenuPrimitive.Root>) { return <ContextMenuPrimitive.Root data-slot=\"context-menu\" {...props} /> } function ContextMenuTrigger({ ...props }: ComponentProps<typeof ContextMenuPrimitive.Trigger>) { return ( <ContextMenuPrimitive.Trigger data-slot=\"context-menu-trigger\" {...props} /> ) } function ContextMenuGroup({ ...props }: ComponentProps<typeof ContextMenuPrimitive.Group>) { return ( <ContextMenuPrimitive.Group data-slot=\"context-menu-group\" {...props} /> ) } func",
  "status": "draft",
  "super_prompt": "Photoreal hero image illustrating: Establish the topic: context-menu. Scene details: context-menu\" import CheckIcon from \"lucide-react/dist/esm/icons/check\"; import ChevronRightIcon from \"lucide-react/dist/esm/icons/chevron-right\" import CircleIcon from \"lucide-react/dist/esm/icons/circle\" import { cn } from \"@/lib/utils\" function ContextMenu({ ...props }: ComponentProps<typeof ContextMenuPrimitive.Root>) { return <ContextMenuPrimitive.Root data-slot=\"context-menu\" {...props} /> } function ContextMenuTrigger({ ...props }: ComponentProps<typeof ContextMenuPrimitive.Trigger>) { return ( <ContextMenuPrimitive.Trigger data-slot=\"context-menu-trigger\" {...props} /> ) } function ContextMenuGroup({ ...props }: ComponentProps<typeof ContextMenuPrimitive.Group>) { return ( <ContextMenuPrimitive.Group data-slot=\"context-menu-group\" {...props} /> ) } func Camera: full-frame, 35mm lens, balanced composition, natural depth of field. Lighting: realistic, soft natural or practical lighting, no harsh artificial glow. Strict realism: natural textures, accurate proportions, realistic lighting, no CGI look, no surreal symmetry. Avoid: logos, watermarks, fake UI buttons, text overlays. Style: photoreal.",
  "technical_constraints": "Aspect ratio 16:9. Target size 1600x900.",
  "updated_at": "2026-01-11T16:42:57Z",
  "usage": "hero"
}