{
  "ad_proximity_risk": "med",
  "alt_text": "Photo of Browse Articles by Category",
  "anchor_index": 1,
  "anchor_selector": "h2:contains(\\\"Browse Articles by Category\\\")",
  "anchor_text": "Browse Articles by Category",
  "aspect_ratio": "4:3",
  "audience_hint": "general audience",
  "constraints": {},
  "discovered_at": "2026-01-10T18:43:01Z",
  "insertion_mode": "after-heading",
  "page_path": "src/components/BlogListPage.tsx",
  "priority_level": "IMPORTANT",
  "prompt": "Photoreal inline image illustrating: Illustrate Browse Articles by Category.",
  "purpose": "Illustrate Browse Articles by Category",
  "realism_profile": "strict_photoreal",
  "recommended_size": "1200x900",
  "refined_at": "2026-01-10T18:59:43Z",
  "risk_factors": [],
  "risk_score": 0.0,
  "slot_id": "86a00a81753d",
  "slot_key": "inline-2",
  "source_context": "Browse Articles by Category </h2> <p className=\"text-muted-foreground\"> Explore safety guides organized by device type and problem area </p> </div> <div className=\"grid gap-6 md:grid-cols-2 lg:grid-cols-3\"> {categories.map((cat) => { const catBlogCount = blogCategories.find(bc => bc.category === cat.id)?.count || 0 return ( <Card key={cat.id} className=\"flex flex-col card-hover\"> <div className=\"flex-1 p-6\"> <h3 className=\"mb-2 text-lg font-semibold text-foreground\"> {cat.name} </h3> <p className=\"mb-4 text-sm text-muted-foreground\"> {cat.descrip",
  "status": "draft",
  "super_prompt": "Photoreal inline image illustrating: Illustrate Browse Articles by Category. Scene details: Browse Articles by Category </h2> <p className=\"text-muted-foreground\"> Explore safety guides organized by device type and problem area </p> </div> <div className=\"grid gap-6 md:grid-cols-2 lg:grid-cols-3\"> {categories.map((cat) => { const catBlogCount = blogCategories.find(bc => bc.category === cat.id)?.count || 0 return ( <Card key={cat.id} className=\"flex flex-col card-hover\"> <div className=\"flex-1 p-6\"> <h3 className=\"mb-2 text-lg font-semibold text-foreground\"> {cat.name} </h3> <p className=\"mb-4 text-sm text-muted-foreground\"> {cat.descrip Camera: full-frame, 35mm lens, balanced composition, natural depth of field. Lighting: realistic, soft natural or practical lighting, no harsh artificial glow. Strict realism: natural textures, accurate proportions, realistic lighting, no CGI look, no surreal symmetry. Avoid: logos, watermarks, fake UI buttons, text overlays. Style: photoreal.",
  "technical_constraints": "Aspect ratio 4:3. Target size 1200x900.",
  "updated_at": "2026-01-11T16:42:57Z",
  "usage": "inline"
}